{
  "$schema": "https://json-schema.org/draft/2020-12/schema",
  "title": "AttackerSummary",
  "description": "one row of GET /attackers: every stored session from one ip_hash, grouped.",
  "type": "object",
  "properties": {
    "ip_hash": {
      "type": "string",
      "pattern": "^[0-9a-f]{64}$",
      "description": "salted sha256 of the source ip"
    },
    "visits": {
      "type": "integer",
      "minimum": 1,
      "description": "number of stored sessions"
    },
    "first_seen": {
      "$ref": "#/$defs/timestamp",
      "description": "earliest session start"
    },
    "last_seen": {
      "$ref": "#/$defs/timestamp",
      "description": "latest activity in any session"
    },
    "latest_session_id": {
      "$ref": "#/$defs/session_id"
    },
    "source": {
      "$ref": "#/$defs/source"
    },
    "geo": {
      "$ref": "#/$defs/Geo"
    },
    "attacker": {
      "$ref": "#/$defs/AttackerProfile"
    },
    "max_threat": {
      "$ref": "#/$defs/threat",
      "description": "highest threat across every stored session"
    },
    "session_ids": {
      "type": "array",
      "items": {
        "$ref": "#/$defs/session_id"
      },
      "minItems": 1,
      "maxItems": 50,
      "description": "newest first by last activity, capped at 50"
    }
  },
  "required": [
    "ip_hash",
    "visits",
    "first_seen",
    "last_seen",
    "latest_session_id",
    "source",
    "geo",
    "attacker",
    "max_threat",
    "session_ids"
  ],
  "additionalProperties": false,
  "$defs": {
    "session_id": {
      "type": "string",
      "minLength": 1,
      "maxLength": 64,
      "description": "opaque id shared by every event in one session"
    },
    "timestamp": {
      "type": "string",
      "pattern": "^\\d{4}-\\d{2}-\\d{2}T\\d{2}:\\d{2}:\\d{2}(\\.\\d{1,6})?Z$",
      "description": "utc, iso 8601, ends in Z, e.g. 2026-10-24T18:03:11.250Z"
    },
    "source": {
      "type": "string",
      "enum": [
        "wild",
        "guest",
        "team",
        "mock"
      ],
      "description": "wild = real internet traffic. only wild counts in stats"
    },
    "Geo": {
      "type": "object",
      "title": "Geo",
      "properties": {
        "lat": {
          "type": "number",
          "minimum": -90,
          "maximum": 90,
          "description": "rounded to 2 decimals"
        },
        "lon": {
          "type": "number",
          "minimum": -180,
          "maximum": 180,
          "description": "rounded to 2 decimals"
        },
        "country": {
          "type": "string",
          "pattern": "^[A-Z]{2}$",
          "description": "iso 3166-1 alpha-2, XX if unknown"
        },
        "city": {
          "type": [
            "string",
            "null"
          ]
        }
      },
      "required": [
        "lat",
        "lon",
        "country",
        "city"
      ],
      "additionalProperties": false
    },
    "AttackerProfile": {
      "type": "object",
      "title": "AttackerProfile",
      "properties": {
        "kind": {
          "type": "string",
          "enum": [
            "bot",
            "human",
            "agent",
            "unknown"
          ]
        },
        "confidence": {
          "type": "number",
          "minimum": 0,
          "maximum": 1
        },
        "reputation": {
          "type": "string",
          "enum": [
            "harmless",
            "unknown",
            "malicious"
          ]
        },
        "family": {
          "type": [
            "string",
            "null"
          ],
          "description": "known botnet or tool family, if any"
        },
        "threat": {
          "$ref": "#/$defs/threat"
        }
      },
      "required": [
        "kind",
        "confidence",
        "reputation",
        "family",
        "threat"
      ],
      "additionalProperties": false,
      "description": "kind and confidence from the most recent session that isn't unknown, the rest from the most recent session"
    },
    "threat": {
      "type": "string",
      "enum": [
        "low",
        "med",
        "high",
        "critical"
      ]
    }
  }
}
